issue_id,class,term_cluster,source_docs,finding_summary,canonical_ruling,resolution_vehicle,status
UDQ-CON-001,CONTRADICTION,active vs archive revision truth,UDQ-GOV-LOG-001 r15; package root structure,"The package previously kept active and superseded revisions in one docs directory, making active-corpus truth depend on a highest-revision inference rather than explicit placement.",Exactly one active revision of each controlled document ID shall live in docs/active. Older revisions shall live in docs/archive.,UDQ-GOV-STD-003 r0; UDQ-IMP-MAP-001 r1; udq_master_audit_v6.py,RESOLVED
UDQ-CON-002,AMBIGUITY,profile / restore / workspace state / machine state,UDQ-PROF-SPEC-001 r0; UDQ-UI-MOD-001 r1; UDQ-ARCH-NAR-001 r3; UDQ-GOV-GLO-001 r1,"The corpus separated continuity from live truth in spirit, but the subsystem layer still needed stronger operational anti-conflation language.",Restore reconstructs local/session/configuration context and shall never by itself imply live machine-state restoration.,UDQ-PROF-SPEC-001 r1; UDQ-UI-MOD-001 r2; UDQ-GOV-RPT-002 r0,RESOLVED
UDQ-CON-003,AMBIGUITY,requested / applied / observed state,UDQ-OUT-SPEC-001 r1; UDQ-UI-SPEC-004 r0; UDQ-REM-SPEC-001 r1; UDQ-GOV-GLO-001 r1,"The corpus used the terms consistently enough for planning, but the subsystem layer still needed stronger anti-conflation language where overlays and remote presentation occur.","Requested, applied, and observed state remain distinct. UI and remote surfaces may visualize them, but shall not redefine or collapse them.",UDQ-OUT-SPEC-001 r2; UDQ-UI-SPEC-004 r1; UDQ-REM-SPEC-001 r2; universalDAQ_term_usage_matrix_r2,RESOLVED
UDQ-CON-004,AMBIGUITY,live / historical / review mode / live trace,UDQ-HIS-SPEC-001 r1; UDQ-UI-SPEC-004 r0; UDQ-UI-MOD-001 r1,"The four terms were centrally defined, but historian and graph-spec language still needed a tighter operational split.","Historical review is evidence exploration, review mode is the broader UI posture, and live trace remains a live explainability surface.",UDQ-HIS-SPEC-001 r2; UDQ-UI-SPEC-004 r1; UDQ-EXM-SPEC-001 r1,RESOLVED
UDQ-CON-005,AMBIGUITY,rules and sequences versus direct writes,UDQ-LOG-SPEC-001 r1; UDQ-SEQ-SPEC-001 r1; UDQ-OUT-SPEC-001 r1,"Rules and sequences were intended to remain governed, but the subsystem layer still needed an explicit statement that they do not bypass arbitration/authorization.",Rules and sequences emit governed requests or state transitions and do not become hidden direct-write paths.,UDQ-LOG-SPEC-001 r2; UDQ-SEQ-SPEC-001 r2; UDQ-OUT-SPEC-001 r2,RESOLVED
UDQ-CON-006,AMBIGUITY,remote capability parity versus backend policy,UDQ-REM-SPEC-001 r1; UDQ-SEC-SPEC-001 r0; UDQ-UI-SPEC-005 r0,"Remote observation and control boundaries were discussed, but the subsystem layer still needed more explicit non-parity and attribution language.",Remote clients are policy-bounded capability classes; parity with local capability shall never be assumed.,UDQ-REM-SPEC-001 r2; UDQ-SEC-SPEC-001 r1; UDQ-GOV-RPT-002 r0,RESOLVED
UDQ-CON-007,AMBIGUITY,authorization versus ui visibility,UDQ-SEC-SPEC-001 r0; UDQ-UI-MOD-001 r1; UDQ-OUT-SPEC-001 r1,"The corpus stated backend authority clearly, but subsystem wording still needed a direct statement that enabled controls do not equal authorization.",Authorization is backend-enforced policy. UI visibility and enabled-state are presentation choices and never constitute authorization by themselves.,UDQ-SEC-SPEC-001 r1; UDQ-OUT-SPEC-001 r2; UDQ-UI-MOD-001 r2,RESOLVED
UDQ-CON-008,AMBIGUITY,alarm acknowledgment and historical truth,UDQ-EVT-SPEC-001 r0; UDQ-HIS-SPEC-001 r1,"The event model already implied evidence retention, but the subsystem docs needed stronger cross-document wording so acknowledgment could not be mistaken for historical erasure.",Acknowledgment records recognition and attribution; it does not erase the alarm/event history.,UDQ-EVT-SPEC-001 r1; UDQ-HIS-SPEC-001 r2; UDQ-EXM-SPEC-001 r1,RESOLVED
