issue_id,duplication_class,source_docs,duplicate_object,disposition,resolution_vehicle,status
UDQ-DUP-001,GOVERNED_BOILERPLATE,UDQ-AUD-TPL-001; UDQ-GAP-TPL-001; UDQ-PROOF-TPL-001,common template skeleton headings and field groups,Accepted as a controlled template family; duplication is structural rather than competing semantic truth.,Register only,ACCEPTED_INTENTIONAL
UDQ-DUP-002,INTENTIONAL_REFERENCE_DUPLICATION,UDQ-ARCH-NAR-001; UDQ-ARCH-NAR-002,safe-state doctrine and backend-authority language,Retained because one narrative states whole-system doctrine and the other states platform/backend doctrine.,Governed by glossary and semantic precedence rules,ACCEPTED_INTENTIONAL
UDQ-DUP-003,SHADOW_DEFINITION,UDQ-PROF-SPEC-001 r0; UDQ-UI-MOD-001 r1; UDQ-ARCH-NAR-001 r3,restore / continuity / machine-state wording,Reduced by moving owning meaning to the glossary and adding explicit anti-conflation language in subsystem docs.,UDQ-PROF-SPEC-001 r1; UDQ-UI-MOD-001 r2,RESOLVED
UDQ-DUP-004,INTENTIONAL_REFERENCE_DUPLICATION,UDQ-UI-NAR-001; UDQ-UI-ARCH-001; UDQ-UI-MOD-001,graph-dominant workflow and explainability chain references,Retained as doctrine plus architecture plus interaction-model reinforcement; meanings remain glossary-owned.,Governed by term matrix and worked examples,ACCEPTED_INTENTIONAL
UDQ-DUP-005,SHADOW_DEFINITION,UDQ-HIS-SPEC-001 r1; UDQ-UI-SPEC-004 r0; UDQ-UI-MOD-001 r1,live / historical / review / live-trace language,Reduced by clarifying term boundaries and letting the graph spec operationalize rather than redefine them.,UDQ-HIS-SPEC-001 r2; UDQ-UI-SPEC-004 r1; UDQ-EXM-SPEC-001 r1,RESOLVED
UDQ-DUP-006,SHADOW_DEFINITION,UDQ-REM-SPEC-001 r1; UDQ-SEC-SPEC-001 r0; UDQ-OUT-SPEC-001 r1,authorization and command-acceptance wording,Reduced by assigning backend authorization doctrine to security/output layers and constraining remote docs to capability and attribution behavior.,UDQ-REM-SPEC-001 r2; UDQ-SEC-SPEC-001 r1; UDQ-OUT-SPEC-001 r2,RESOLVED
UDQ-DUP-007,INTENTIONAL_REFERENCE_DUPLICATION,UDQ-EVT-SPEC-001; UDQ-HIS-SPEC-001,alarm/event evidence linkage,"Retained because event lifecycle and historian evidence must both reference the relationship, but neither may redefine the other's primary object model.",Governed by contradiction register and worked examples,ACCEPTED_INTENTIONAL
UDQ-DUP-008,INTENTIONAL_REFERENCE_DUPLICATION,UDQ-GOV-STD-003; UDQ-IMP-MAP-001,frozen package root structure,Retained because the governance standard owns placement rules while the implementation map owns module boundary explanation.,Governed by package structure standard,ACCEPTED_INTENTIONAL
